{
  "candidate_id": "PFA-M04-R1",
  "model_id": "M04",
  "throat_radius_m": 1.0,
  "cutoff_radius_m": 10.0,
  "speed_fraction_c": 0.01,
  "payload_radius_m": 0.1,
  "payload_separation_m": 2.0,
  "tidal_limit_m_s2": 9.80665,
  "exterior_travel_time_s": 1.0,
  "wormhole_travel_time_s": 0.1,
  "mouth_time_offset_s": 0.0,
  "uncertainty_external_s": 0.0,
  "uncertainty_internal_s": 0.0,
  "uncertainty_offset_s": 0.0,
  "causal_guard_margin_s": 0.1
}
